{
    "schema_version":  "1.0.0",
    "system":  "global-governance-lock-system",
    "status":  "active",
    "target_durability":  "50y",
    "source_of_truth":  "repository",
    "minimum_lock_count":  32,
    "failure_mode":  "block merge",
    "locks":  [
                  {
                      "id":  "GOV-LOCK-001",
                      "name":  "Immutable Roadmap ID Registry",
                      "status":  "active",
                      "scope":  "repository-wide",
                      "owner":  "governance",
                      "risk_class":  "critical",
                      "retention":  "50y",
                      "enforcement":  [
                                          "documentation",
                                          "json-registry",
                                          "schema-validation",
                                          "pytest",
                                          "github-actions"
                                      ],
                      "change_control":  "PR + required review + CI pass",
                      "failure_mode":  "block merge",
                      "evidence_required":  true,
                      "supersession_allowed":  true,
                      "deletion_allowed":  false,
                      "immutable":  true,
                      "source_of_truth":  "repo",
                      "notes":  "Global-grade 50-year governance lock. Changes must preserve ID continuity, traceability, reviewability, and repository durability."
                  },
                  {
                      "id":  "GOV-LOCK-002",
                      "name":  "Immutable Requirement ID Registry",
                      "status":  "active",
                      "scope":  "repository-wide",
                      "owner":  "governance",
                      "risk_class":  "critical",
                      "retention":  "50y",
                      "enforcement":  [
                                          "documentation",
                                          "json-registry",
                                          "schema-validation",
                                          "pytest",
                                          "github-actions"
                                      ],
                      "change_control":  "PR + required review + CI pass",
                      "failure_mode":  "block merge",
                      "evidence_required":  true,
                      "supersession_allowed":  true,
                      "deletion_allowed":  false,
                      "immutable":  true,
                      "source_of_truth":  "repo",
                      "notes":  "Global-grade 50-year governance lock. Changes must preserve ID continuity, traceability, reviewability, and repository durability."
                  },
                  {
                      "id":  "GOV-LOCK-003",
                      "name":  "Immutable Governance Lock ID Registry",
                      "status":  "active",
                      "scope":  "repository-wide",
                      "owner":  "governance",
                      "risk_class":  "critical",
                      "retention":  "50y",
                      "enforcement":  [
                                          "documentation",
                                          "json-registry",
                                          "schema-validation",
                                          "pytest",
                                          "github-actions"
                                      ],
                      "change_control":  "PR + required review + CI pass",
                      "failure_mode":  "block merge",
                      "evidence_required":  true,
                      "supersession_allowed":  true,
                      "deletion_allowed":  false,
                      "immutable":  true,
                      "source_of_truth":  "repo",
                      "notes":  "Global-grade 50-year governance lock. Changes must preserve ID continuity, traceability, reviewability, and repository durability."
                  },
                  {
                      "id":  "GOV-LOCK-004",
                      "name":  "Source-of-Truth Repository Lock",
                      "status":  "active",
                      "scope":  "repository-wide",
                      "owner":  "governance",
                      "risk_class":  "critical",
                      "retention":  "50y",
                      "enforcement":  [
                                          "documentation",
                                          "json-registry",
                                          "schema-validation",
                                          "pytest",
                                          "github-actions"
                                      ],
                      "change_control":  "PR + required review + CI pass",
                      "failure_mode":  "block merge",
                      "evidence_required":  true,
                      "supersession_allowed":  true,
                      "deletion_allowed":  false,
                      "immutable":  true,
                      "source_of_truth":  "repo",
                      "notes":  "Global-grade 50-year governance lock. Changes must preserve ID continuity, traceability, reviewability, and repository durability."
                  },
                  {
                      "id":  "GOV-LOCK-005",
                      "name":  "Governance Change Approval Matrix",
                      "status":  "active",
                      "scope":  "repository-wide",
                      "owner":  "governance",
                      "risk_class":  "critical",
                      "retention":  "50y",
                      "enforcement":  [
                                          "documentation",
                                          "json-registry",
                                          "schema-validation",
                                          "pytest",
                                          "github-actions"
                                      ],
                      "change_control":  "PR + required review + CI pass",
                      "failure_mode":  "block merge",
                      "evidence_required":  true,
                      "supersession_allowed":  true,
                      "deletion_allowed":  false,
                      "immutable":  false,
                      "source_of_truth":  "repo",
                      "notes":  "Global-grade 50-year governance lock. Changes must preserve ID continuity, traceability, reviewability, and repository durability."
                  },
                  {
                      "id":  "GOV-LOCK-006",
                      "name":  "Deprecation and Supersession Lock",
                      "status":  "active",
                      "scope":  "repository-wide",
                      "owner":  "governance",
                      "risk_class":  "high",
                      "retention":  "50y",
                      "enforcement":  [
                                          "documentation",
                                          "json-registry",
                                          "schema-validation",
                                          "pytest",
                                          "github-actions"
                                      ],
                      "change_control":  "PR + required review + CI pass",
                      "failure_mode":  "block merge",
                      "evidence_required":  true,
                      "supersession_allowed":  true,
                      "deletion_allowed":  false,
                      "immutable":  false,
                      "source_of_truth":  "repo",
                      "notes":  "Global-grade 50-year governance lock. Changes must preserve ID continuity, traceability, reviewability, and repository durability."
                  },
                  {
                      "id":  "GOV-LOCK-007",
                      "name":  "Artifact Retention 50-Year Lock",
                      "status":  "active",
                      "scope":  "repository-wide",
                      "owner":  "governance",
                      "risk_class":  "critical",
                      "retention":  "50y",
                      "enforcement":  [
                                          "documentation",
                                          "json-registry",
                                          "schema-validation",
                                          "pytest",
                                          "github-actions"
                                      ],
                      "change_control":  "PR + required review + CI pass",
                      "failure_mode":  "block merge",
                      "evidence_required":  true,
                      "supersession_allowed":  true,
                      "deletion_allowed":  false,
                      "immutable":  true,
                      "source_of_truth":  "repo",
                      "notes":  "Global-grade 50-year governance lock. Changes must preserve ID continuity, traceability, reviewability, and repository durability."
                  },
                  {
                      "id":  "GOV-LOCK-008",
                      "name":  "Evidence Ledger Lock",
                      "status":  "active",
                      "scope":  "repository-wide",
                      "owner":  "governance",
                      "risk_class":  "critical",
                      "retention":  "50y",
                      "enforcement":  [
                                          "documentation",
                                          "json-registry",
                                          "schema-validation",
                                          "pytest",